{
  "receipt_id": "nc-collector-preview-request-001",
  "status": "draft",
  "created_at": "2026-05-04T09:00:00Z",
  "project": "NanoClaw public-safe provenance examples",
  "action": {
    "type": "collector_preview_request",
    "summary": "Draft request for a human-reviewed collector preview without publishing private source assets or executing payment.",
    "tool_boundary": "The agent may prepare a preview checklist and public-safe metadata, but cannot publish assets, connect wallets, mint NFTs, or send payment."
  },
  "human_review": {
    "required": true,
    "reviewer": "collection_owner",
    "decision": "pending"
  },
  "asset_reference": {
    "object_id": "public-safe-example-object",
    "public_asset": false,
    "hash": "not_recorded_in_public_example"
  },
  "payment_reference": {
    "required": false,
    "rail": "none",
    "amount": "0",
    "currency": "N/A",
    "settlement_status": "not_applicable"
  },
  "notes": "This example models the approval boundary for a future collector preview. It contains no private image, wallet address, token, transaction, or buyer data."
}
